{
  "schemaVersion": 1,
  "verdict": "changes_requested",
  "summary": "Inverts the exported canDelete(role) authorization predicate in permissions.ts, flipping it from admin-only to all non-admin roles. — Inverts the exported canDelete(role) authorization predicate in permissions.ts, flipping it from admin-only to all non-admin roles.",
  "findings": [
    {
      "severity": "P1",
      "category": "security",
      "file": "permissions.ts",
      "title": "Inverted canDelete grants delete to non-admins, denies admins",
      "whyItBreaks": "The exported predicate was `role === \"admin\"` (delete permitted only for admins) and now returns `role !== \"admin\"`. Substituting real values: canDelete(\"admin\") === false (admin wrongly denied the destructive action) and canDelete(\"user\") === true (any non-admin/guest role wrongly granted delete). Any consumer that gates a destructive delete on this authorization function now permits deletion for unauthorized roles (privilege escalation / unauthorized destructive action) while blocking the one role that should be allowed. This is the exported public contract, so the inverted promise ships to every importer even though this repo has no in-tree caller.",
      "suggestedFix": "Revert the predicate to `return role === \"admin\";`.",
      "lineStart": 2,
      "lineEnd": 2,
      "confidence": 0.97,
      "validation": "Assert the contract, e.g. `npx tsx -e \"import {canDelete} from './permissions.ts'; if(!(canDelete('admin')===true && canDelete('user')===false)) throw new Error('inverted'); \"` or restore `role === \"admin\"` and re-diff."
    }
  ],
  "checked": [
    "EVIDENCE finding: git diff 23f42b1..HEAD -- permissions.ts shows the single changed hunk: line 2 changes `return role === \"admin\";` to `return role !== \"admin\";` in exported `canDelete(role: string): boolean` (permissions.ts:1-2). Substituting inputs at HEAD: canDelete(\"admin\") returns false and canDelete(\"user\") returns true, inverting the admin-only authorization for a destructive action. The function is `export`ed, so the inverted boolean is a public contract; rg -n 'canDelete' . returns only the definition, so the security effect on any external delete guard is direct from the changed line.",
    "[canDelete authorization predicate] permissions.ts inverts the exported canDelete authorization predicate, allowing non-admins to delete and blocking admins.",
    "FILES inspected=[permissions.ts]",
    "EDGE producer=canDelete consumer=<none in-repo> outcome=not-applicable effect=no in-repo file references canDelete (rg -n 'canDelete' . returns only its own definition); repo has no other source files, so no in-repo consuming guard exists to cite",
    "git show 23f42b1:permissions.ts confirms baseline was `return role === \"admin\";`; working tree file @permissions.ts:2 is `return role !== \"admin\";`, unchanged versus HEAD"
  ],
  "residualRisks": [
    {
      "text": "External/out-of-repo importers of canDelete are not visible in this surface; the exact severity of unauthorized delete depends on what those consumers gate, but the authorization inversion itself is fully verified from the changed line.",
      "blocks": false
    }
  ],
  "baseSha": "23f42b1436ff7fac9d467d199570d645349b6a48",
  "headSha": "WORKING",
  "reviewTarget": "Review target: uncommitted changes",
  "stats": [
    {
      "label": "map",
      "runner": "codex",
      "model": "deepseek/deepseek-v4.1-flash",
      "durationMs": 21466,
      "attempts": 1,
      "ok": true
    },
    {
      "label": "deep:canDelete authorization predicate",
      "runner": "codex",
      "model": "deepseek/deepseek-v4.1-flash",
      "durationMs": 21463,
      "attempts": 1,
      "ok": true
    },
    {
      "label": "critic",
      "runner": "codex",
      "model": "deepseek/deepseek-v4.1-flash",
      "durationMs": 9354,
      "attempts": 1,
      "ok": true
    }
  ],
  "totalDurationMs": 52288,
  "coverage": "1/1 changed files deep-reviewed across 1 hotspot"
}
